{
  "schema_version": "1.0.0",
  "method": "docs/RESEARCH_METHOD.md#coverage",
  "as_of": "2026-10-23",
  "rows": [
    {
      "id": "COV-MODALITY-TEXT",
      "dimension": "modality",
      "term": "Text",
      "owning_work_package": "DATA-03.01",
      "existing_research_owners": [
        "Pick-Your-AI/pick-your-ai-research#32"
      ],
      "denominator": null,
      "denominator_source": null,
      "denominator_counted_on": null,
      "candidate_records": 0,
      "accepted_records": 0,
      "status": "not_started",
      "evidence_confidence": "Unverified",
      "note": "Denominator not yet counted; unknown is not zero."
    },
    {
      "id": "COV-MODALITY-CODE",
      "dimension": "modality",
      "term": "Code",
      "owning_work_package": "DATA-03.01",
      "existing_research_owners": [
        "Pick-Your-AI/pick-your-ai-research#32"
      ],
      "denominator": null,
      "denominator_source": null,
      "denominator_counted_on": null,
      "candidate_records": 0,
      "accepted_records": 0,
      "status": "not_started",
      "evidence_confidence": "Unverified",
      "note": "Denominator not yet counted; unknown is not zero."
    },
    {
      "id": "COV-MODALITY-IMAGE",
      "dimension": "modality",
      "term": "Image",
      "owning_work_package": "DATA-03.02",
      "existing_research_owners": [],
      "denominator": null,
      "denominator_source": null,
      "denominator_counted_on": null,
      "candidate_records": 0,
      "accepted_records": 0,
      "status": "not_started",
      "evidence_confidence": "Unverified",
      "note": "Denominator not yet counted; unknown is not zero."
    },
    {
      "id": "COV-MODALITY-VIDEO",
      "dimension": "modality",
      "term": "Video",
      "owning_work_package": "DATA-03.02",
      "existing_research_owners": [],
      "denominator": null,
      "denominator_source": null,
      "denominator_counted_on": null,
      "candidate_records": 0,
      "accepted_records": 0,
      "status": "not_started",
      "evidence_confidence": "Unverified",
      "note": "Denominator not yet counted; unknown is not zero."
    },
    {
      "id": "COV-MODALITY-AUDIO",
      "dimension": "modality",
      "term": "Speech & Audio",
      "owning_work_package": "DATA-03.03",
      "existing_research_owners": [],
      "denominator": null,
      "denominator_source": null,
      "denominator_counted_on": null,
      "candidate_records": 0,
      "accepted_records": 0,
      "status": "not_started",
      "evidence_confidence": "Unverified",
      "note": "Denominator not yet counted; unknown is not zero."
    },
    {
      "id": "COV-MODALITY-MULTIMODAL",
      "dimension": "modality",
      "term": "Multimodal",
      "owning_work_package": "DATA-03.04",
      "existing_research_owners": [],
      "denominator": null,
      "denominator_source": null,
      "denominator_counted_on": null,
      "candidate_records": 0,
      "accepted_records": 0,
      "status": "not_started",
      "evidence_confidence": "Unverified",
      "note": "Denominator not yet counted; unknown is not zero."
    },
    {
      "id": "COV-MODALITY-TIMESERIES",
      "dimension": "modality",
      "term": "Time Series",
      "owning_work_package": "DATA-03.05",
      "existing_research_owners": [],
      "denominator": null,
      "denominator_source": null,
      "denominator_counted_on": null,
      "candidate_records": 0,
      "accepted_records": 0,
      "status": "not_started",
      "evidence_confidence": "Unverified",
      "note": "Denominator not yet counted; unknown is not zero."
    },
    {
      "id": "COV-MODALITY-TABULAR",
      "dimension": "modality",
      "term": "Tabular",
      "owning_work_package": "DATA-03.05",
      "existing_research_owners": [],
      "denominator": null,
      "denominator_source": null,
      "denominator_counted_on": null,
      "candidate_records": 0,
      "accepted_records": 0,
      "status": "not_started",
      "evidence_confidence": "Unverified",
      "note": "Denominator not yet counted; unknown is not zero."
    },
    {
      "id": "COV-MODALITY-GEOSPATIAL",
      "dimension": "modality",
      "term": "Geospatial",
      "owning_work_package": "DATA-03.05",
      "existing_research_owners": [],
      "denominator": null,
      "denominator_source": null,
      "denominator_counted_on": null,
      "candidate_records": 0,
      "accepted_records": 0,
      "status": "not_started",
      "evidence_confidence": "Unverified",
      "note": "Denominator not yet counted; unknown is not zero."
    },
    {
      "id": "COV-MODALITY-ROBOTICS",
      "dimension": "modality",
      "term": "Robotics",
      "owning_work_package": "DATA-03.06",
      "existing_research_owners": [],
      "denominator": null,
      "denominator_source": null,
      "denominator_counted_on": null,
      "candidate_records": 0,
      "accepted_records": 0,
      "status": "not_started",
      "evidence_confidence": "Unverified",
      "note": "Denominator not yet counted; unknown is not zero."
    },
    {
      "id": "COV-MODALITY-SCIENTIFIC",
      "dimension": "modality",
      "term": "Scientific",
      "owning_work_package": "DATA-03.06",
      "existing_research_owners": [],
      "denominator": null,
      "denominator_source": null,
      "denominator_counted_on": null,
      "candidate_records": 0,
      "accepted_records": 0,
      "status": "not_started",
      "evidence_confidence": "Unverified",
      "note": "Denominator not yet counted; unknown is not zero."
    },
    {
      "id": "COV-MODALITY-GRAPH",
      "dimension": "modality",
      "term": "Graph & Structured",
      "owning_work_package": "DATA-03.06",
      "existing_research_owners": [],
      "denominator": null,
      "denominator_source": null,
      "denominator_counted_on": null,
      "candidate_records": 0,
      "accepted_records": 0,
      "status": "not_started",
      "evidence_confidence": "Unverified",
      "note": "Denominator not yet counted; unknown is not zero."
    },
    {
      "id": "COV-BENCHMARK-LANGUAGE",
      "dimension": "benchmark",
      "term": "Language understanding",
      "owning_work_package": "DATA-07.02",
      "existing_research_owners": [
        "Pick-Your-AI/pick-your-ai-research#36"
      ],
      "denominator": null,
      "denominator_source": null,
      "denominator_counted_on": null,
      "candidate_records": 0,
      "accepted_records": 0,
      "status": "not_started",
      "evidence_confidence": "Unverified",
      "note": "Denominator not yet counted; unknown is not zero."
    },
    {
      "id": "COV-BENCHMARK-REASONING",
      "dimension": "benchmark",
      "term": "Reasoning",
      "owning_work_package": "DATA-07.02",
      "existing_research_owners": [
        "Pick-Your-AI/pick-your-ai-research#36"
      ],
      "denominator": null,
      "denominator_source": null,
      "denominator_counted_on": null,
      "candidate_records": 0,
      "accepted_records": 0,
      "status": "not_started",
      "evidence_confidence": "Unverified",
      "note": "Denominator not yet counted; unknown is not zero."
    },
    {
      "id": "COV-BENCHMARK-CODING",
      "dimension": "benchmark",
      "term": "Coding and software engineering",
      "owning_work_package": "DATA-07.03",
      "existing_research_owners": [
        "Pick-Your-AI/pick-your-ai-research#36"
      ],
      "denominator": null,
      "denominator_source": null,
      "denominator_counted_on": null,
      "candidate_records": 0,
      "accepted_records": 0,
      "status": "not_started",
      "evidence_confidence": "Unverified",
      "note": "Denominator not yet counted; unknown is not zero."
    },
    {
      "id": "COV-BENCHMARK-VISION",
      "dimension": "benchmark",
      "term": "Vision",
      "owning_work_package": "DATA-07.04",
      "existing_research_owners": [
        "Pick-Your-AI/pick-your-ai-research#36"
      ],
      "denominator": null,
      "denominator_source": null,
      "denominator_counted_on": null,
      "candidate_records": 0,
      "accepted_records": 0,
      "status": "not_started",
      "evidence_confidence": "Unverified",
      "note": "Denominator not yet counted; unknown is not zero."
    },
    {
      "id": "COV-BENCHMARK-AUDIO",
      "dimension": "benchmark",
      "term": "Speech and audio",
      "owning_work_package": "DATA-07.04",
      "existing_research_owners": [
        "Pick-Your-AI/pick-your-ai-research#36"
      ],
      "denominator": null,
      "denominator_source": null,
      "denominator_counted_on": null,
      "candidate_records": 0,
      "accepted_records": 0,
      "status": "not_started",
      "evidence_confidence": "Unverified",
      "note": "Denominator not yet counted; unknown is not zero."
    },
    {
      "id": "COV-BENCHMARK-MULTIMODAL",
      "dimension": "benchmark",
      "term": "Multimodal",
      "owning_work_package": "DATA-07.04",
      "existing_research_owners": [
        "Pick-Your-AI/pick-your-ai-research#36"
      ],
      "denominator": null,
      "denominator_source": null,
      "denominator_counted_on": null,
      "candidate_records": 0,
      "accepted_records": 0,
      "status": "not_started",
      "evidence_confidence": "Unverified",
      "note": "Denominator not yet counted; unknown is not zero."
    },
    {
      "id": "COV-BENCHMARK-RETRIEVAL",
      "dimension": "benchmark",
      "term": "Retrieval and reranking",
      "owning_work_package": "DATA-07.05",
      "existing_research_owners": [
        "Pick-Your-AI/pick-your-ai-research#14",
        "Pick-Your-AI/pick-your-ai-research#16",
        "Pick-Your-AI/pick-your-ai-research#36"
      ],
      "denominator": null,
      "denominator_source": null,
      "denominator_counted_on": null,
      "candidate_records": 0,
      "accepted_records": 0,
      "status": "not_started",
      "evidence_confidence": "Unverified",